{
  "$schema": "http://json-schema.org/draft-07/schema#",
  "$id": "https://ruttekut.github.io/trustoo-brevo-feeds/schemas/posthire-done-feed.schema.json",
  "title": "Trustoo Brevo e-mailfeed (post-hire mail 1b, DONE)",
  "description": "Plat JSON-object met de 37 velden die trustoo-posthire-done-template.html gebruikt (alias posthire_done_feed). Kaarten 3-4 en het blok 'Ook populair' worden verborgen via r*_style en popular_style ('display:none; mso-hide:all;'). Geen arrays of geneste objecten.",
  "type": "object",
  "additionalProperties": false,
  "required": [
    "title",
    "subject_line",
    "preheader",
    "campaign_key",
    "hero_image_url",
    "hero_image_alt",
    "hero_subtitle",
    "services_intro",
    "service1_name",
    "service1_label",
    "service1_price",
    "service1_url",
    "service1_style",
    "service2_name",
    "service2_label",
    "service2_price",
    "service2_url",
    "service2_style",
    "service3_name",
    "service3_label",
    "service3_price",
    "service3_url",
    "service3_style",
    "service4_name",
    "service4_label",
    "service4_price",
    "service4_url",
    "service4_style",
    "tile1_name",
    "tile1_url",
    "tile2_name",
    "tile2_url",
    "tile3_name",
    "tile3_url",
    "tile4_name",
    "tile4_url",
    "tiles_style"
  ],
  "properties": {
    "title": {
      "type": "string",
      "minLength": 1
    },
    "subject_line": {
      "type": "string",
      "minLength": 1
    },
    "preheader": {
      "type": "string",
      "minLength": 1
    },
    "campaign_key": {
      "type": "string",
      "minLength": 1
    },
    "hero_image_url": {
      "type": "string",
      "minLength": 1
    },
    "hero_image_alt": {
      "type": "string",
      "minLength": 1
    },
    "hero_subtitle": {
      "type": "string",
      "minLength": 1
    },
    "services_intro": {
      "type": "string",
      "minLength": 1
    },
    "service1_name": {
      "type": "string",
      "minLength": 1
    },
    "service1_label": {
      "type": "string",
      "minLength": 1
    },
    "service1_price": {
      "type": "string",
      "minLength": 1
    },
    "service1_url": {
      "type": "string",
      "minLength": 1
    },
    "service1_style": {
      "type": "string"
    },
    "service2_name": {
      "type": "string",
      "minLength": 1
    },
    "service2_label": {
      "type": "string",
      "minLength": 1
    },
    "service2_price": {
      "type": "string",
      "minLength": 1
    },
    "service2_url": {
      "type": "string",
      "minLength": 1
    },
    "service2_style": {
      "type": "string"
    },
    "service3_name": {
      "type": "string"
    },
    "service3_label": {
      "type": "string"
    },
    "service3_price": {
      "type": "string"
    },
    "service3_url": {
      "type": "string"
    },
    "service3_style": {
      "type": "string"
    },
    "service4_name": {
      "type": "string"
    },
    "service4_label": {
      "type": "string"
    },
    "service4_price": {
      "type": "string"
    },
    "service4_url": {
      "type": "string"
    },
    "service4_style": {
      "type": "string"
    },
    "tile1_name": {
      "type": "string",
      "minLength": 1
    },
    "tile1_url": {
      "type": "string",
      "minLength": 1
    },
    "tile2_name": {
      "type": "string",
      "minLength": 1
    },
    "tile2_url": {
      "type": "string",
      "minLength": 1
    },
    "tile3_name": {
      "type": "string",
      "minLength": 1
    },
    "tile3_url": {
      "type": "string",
      "minLength": 1
    },
    "tile4_name": {
      "type": "string",
      "minLength": 1
    },
    "tile4_url": {
      "type": "string",
      "minLength": 1
    },
    "tiles_style": {
      "type": "string"
    }
  }
}
