{
  "title": "Fijn dat je keukenspecialist geregeld is",
  "subject_line": "Fijn dat je keukenspecialist geregeld is",
  "preheader": "En heb je straks nog iets anders nodig? Dit vragen mensen daarna vaak aan.",
  "campaign_key": "posthire_keukenrenovatie",
  "hero_image_url": "https://img.mailinblue.com/9986607/images/content_library/original/69f86509250cf8603631187d.png",
  "hero_image_alt": "Keuken renoveren?",
  "hero_subtitle": "Je aanvraag voor een keukenspecialist is afgerond. Heb je straks nog iets anders nodig? Op Trustoo vergelijk je gratis de beste bedrijven bij jou in de buurt.",
  "services_intro": "Dit vragen mensen na een keukenspecialist vaak ook aan.",
  "service1_name": "Loodgieter",
  "service1_label": "Voor water en afvoer",
  "service1_price": "€ 40 – € 80 per uur",
  "service1_url": "https://trustoo.nl/nederland/loodgieter/?utm_source=brevo&utm_medium=email&utm_campaign=posthire_keukenrenovatie&utm_content=gerelateerd1",
  "service1_style": "",
  "service2_name": "Elektricien",
  "service2_label": "Voor stroom en verlichting",
  "service2_price": "€ 35 – € 70 per uur",
  "service2_url": "https://trustoo.nl/nederland/elektricien/?utm_source=brevo&utm_medium=email&utm_campaign=posthire_keukenrenovatie&utm_content=gerelateerd2",
  "service2_style": "",
  "service3_name": "Tegelzetter",
  "service3_label": "Voor tegelwerk",
  "service3_price": "€ 25 – € 40 per m²",
  "service3_url": "https://trustoo.nl/nederland/tegelzetter/?utm_source=brevo&utm_medium=email&utm_campaign=posthire_keukenrenovatie&utm_content=gerelateerd3",
  "service3_style": "",
  "service4_name": "Vloerlegger",
  "service4_label": "Voor een nieuwe vloer",
  "service4_price": "€ 25 – € 75 per m²",
  "service4_url": "https://trustoo.nl/nederland/vloerlegger/?utm_source=brevo&utm_medium=email&utm_campaign=posthire_keukenrenovatie&utm_content=gerelateerd4",
  "service4_style": "",
  "tile1_name": "Rijschool",
  "tile1_url": "https://trustoo.nl/nederland/rijschool/?utm_source=brevo&utm_medium=email&utm_campaign=posthire_keukenrenovatie&utm_content=populair1",
  "tile2_name": "Schoonmaakbedrijf",
  "tile2_url": "https://trustoo.nl/nederland/schoonmaakbedrijf/?utm_source=brevo&utm_medium=email&utm_campaign=posthire_keukenrenovatie&utm_content=populair2",
  "tile3_name": "Notaris",
  "tile3_url": "https://trustoo.nl/nederland/notaris/?utm_source=brevo&utm_medium=email&utm_campaign=posthire_keukenrenovatie&utm_content=populair3",
  "tile4_name": "Schilder",
  "tile4_url": "https://trustoo.nl/nederland/schilder/?utm_source=brevo&utm_medium=email&utm_campaign=posthire_keukenrenovatie&utm_content=populair4",
  "tiles_style": ""
}
