{
  "title": "Fijn dat je onlinemarketingbureau geregeld is",
  "subject_line": "Fijn dat je onlinemarketingbureau geregeld is",
  "preheader": "En heb je straks nog iets anders nodig? Dit vragen mensen daarna vaak aan.",
  "campaign_key": "posthire_online-marketing",
  "hero_image_url": "https://img.mailinblue.com/9986607/images/content_library/original/69fdbabdc0930e7c615624c1.png",
  "hero_image_alt": "Onlinemarketingbureau aan het werk",
  "hero_subtitle": "Je aanvraag voor een onlinemarketingbureau is afgerond. Heb je straks nog iets anders nodig? Op Trustoo vergelijk je gratis de beste bedrijven bij jou in de buurt.",
  "services_intro": "Dit vragen mensen na een onlinemarketingbureau vaak ook aan.",
  "service1_name": "SEO-specialist",
  "service1_label": "Voor betere vindbaarheid",
  "service1_price": "Prijs op maat",
  "service1_url": "https://trustoo.nl/nederland/seo-specialist/?utm_source=brevo&utm_medium=email&utm_campaign=posthire_online-marketing&utm_content=gerelateerd1",
  "service1_style": "",
  "service2_name": "Webdesigner",
  "service2_label": "Voor je website",
  "service2_price": "Basis: € 500 – € 2.000",
  "service2_url": "https://trustoo.nl/nederland/webdesign/?utm_source=brevo&utm_medium=email&utm_campaign=posthire_online-marketing&utm_content=gerelateerd2",
  "service2_style": "",
  "service3_name": "Tekstschrijver",
  "service3_label": "Voor goede teksten",
  "service3_price": "Prijs op maat",
  "service3_url": "https://trustoo.nl/nederland/tekstschrijver/?utm_source=brevo&utm_medium=email&utm_campaign=posthire_online-marketing&utm_content=gerelateerd3",
  "service3_style": "",
  "service4_name": "Grafisch ontwerper",
  "service4_label": "Voor een sterk ontwerp",
  "service4_price": "Prijs op maat",
  "service4_url": "https://trustoo.nl/nederland/grafisch-ontwerper/?utm_source=brevo&utm_medium=email&utm_campaign=posthire_online-marketing&utm_content=gerelateerd4",
  "service4_style": "",
  "tile1_name": "Rijschool",
  "tile1_url": "https://trustoo.nl/nederland/rijschool/?utm_source=brevo&utm_medium=email&utm_campaign=posthire_online-marketing&utm_content=populair1",
  "tile2_name": "Schoonmaakbedrijf",
  "tile2_url": "https://trustoo.nl/nederland/schoonmaakbedrijf/?utm_source=brevo&utm_medium=email&utm_campaign=posthire_online-marketing&utm_content=populair2",
  "tile3_name": "Notaris",
  "tile3_url": "https://trustoo.nl/nederland/notaris/?utm_source=brevo&utm_medium=email&utm_campaign=posthire_online-marketing&utm_content=populair3",
  "tile4_name": "Schilder",
  "tile4_url": "https://trustoo.nl/nederland/schilder/?utm_source=brevo&utm_medium=email&utm_campaign=posthire_online-marketing&utm_content=populair4",
  "tiles_style": ""
}
