{
  "title": "Fijn dat je beveiligingsbedrijf geregeld is",
  "subject_line": "Fijn dat je beveiligingsbedrijf geregeld is",
  "preheader": "En heb je straks nog iets anders nodig? Dit vragen mensen daarna vaak aan.",
  "campaign_key": "posthire_beveiliging",
  "hero_image_url": "https://img.mailinblue.com/9986607/images/rnb/original/6a99ca5bb423db7c1ead99ae.jpg",
  "hero_image_alt": "Beveiliger aan het werk: bedrijfspand controleren",
  "hero_subtitle": "Je aanvraag voor een beveiligingsbedrijf is afgerond. Heb je straks nog iets anders nodig? Op Trustoo vergelijk je gratis de beste bedrijven bij jou in de buurt.",
  "services_intro": "Dit vragen mensen na een beveiligingsbedrijf vaak ook aan.",
  "service1_name": "Alarmsysteem",
  "service1_label": "Voor een veilig huis",
  "service1_price": "Prijs op maat",
  "service1_url": "https://trustoo.nl/nederland/alarmsystemen/?utm_source=brevo&utm_medium=email&utm_campaign=posthire_beveiliging&utm_content=gerelateerd1",
  "service1_style": "",
  "service2_name": "Elektricien",
  "service2_label": "Voor camera's en verlichting",
  "service2_price": "€ 35 – € 70 per uur",
  "service2_url": "https://trustoo.nl/nederland/elektricien/?utm_source=brevo&utm_medium=email&utm_campaign=posthire_beveiliging&utm_content=gerelateerd2",
  "service2_style": "",
  "service3_name": "Boekhouder",
  "service3_label": "Voor je boekhouding",
  "service3_price": "€ 45 – € 75 per uur",
  "service3_url": "https://trustoo.nl/nederland/boekhouder/?utm_source=brevo&utm_medium=email&utm_campaign=posthire_beveiliging&utm_content=gerelateerd3",
  "service3_style": "display:none; mso-hide:all;",
  "service4_name": "",
  "service4_label": "",
  "service4_price": "",
  "service4_url": "https://trustoo.nl/",
  "service4_style": "display:none; mso-hide:all;",
  "tile1_name": "Rijschool",
  "tile1_url": "https://trustoo.nl/nederland/rijschool/?utm_source=brevo&utm_medium=email&utm_campaign=posthire_beveiliging&utm_content=populair1",
  "tile2_name": "Schoonmaakbedrijf",
  "tile2_url": "https://trustoo.nl/nederland/schoonmaakbedrijf/?utm_source=brevo&utm_medium=email&utm_campaign=posthire_beveiliging&utm_content=populair2",
  "tile3_name": "Notaris",
  "tile3_url": "https://trustoo.nl/nederland/notaris/?utm_source=brevo&utm_medium=email&utm_campaign=posthire_beveiliging&utm_content=populair3",
  "tile4_name": "Schilder",
  "tile4_url": "https://trustoo.nl/nederland/schilder/?utm_source=brevo&utm_medium=email&utm_campaign=posthire_beveiliging&utm_content=populair4",
  "tiles_style": ""
}
