{
  "title": "Fijn dat je asbestverwijderaar geregeld is",
  "subject_line": "Fijn dat je asbestverwijderaar geregeld is",
  "preheader": "En heb je straks nog iets anders nodig? Dit vragen mensen daarna vaak aan.",
  "campaign_key": "posthire_asbest",
  "hero_image_url": "https://img.mailinblue.com/9986607/images/rnb/original/6a99ca57d6d15096d2e48aaf.jpg",
  "hero_image_alt": "Asbestsaneerder aan het werk: asbestmateriaal veilig verwijderen",
  "hero_subtitle": "Je aanvraag voor een asbestverwijderaar is afgerond. Heb je straks nog iets anders nodig? Op Trustoo vergelijk je gratis de beste bedrijven bij jou in de buurt.",
  "services_intro": "Dit vragen mensen na een asbestverwijderaar vaak ook aan.",
  "service1_name": "Sloopbedrijf",
  "service1_label": "Voor sloopwerk",
  "service1_price": "Prijs op maat",
  "service1_url": "https://trustoo.nl/nederland/sloopbedrijf/?utm_source=brevo&utm_medium=email&utm_campaign=posthire_asbest&utm_content=gerelateerd1",
  "service1_style": "",
  "service2_name": "Aannemer",
  "service2_label": "Voor bouwen en verbouwen",
  "service2_price": "€ 35 – € 60 per uur",
  "service2_url": "https://trustoo.nl/nederland/aannemer/?utm_source=brevo&utm_medium=email&utm_campaign=posthire_asbest&utm_content=gerelateerd2",
  "service2_style": "",
  "service3_name": "Bouwkundig keurder",
  "service3_label": "Voor zekerheid vooraf",
  "service3_price": "€ 350 – € 500",
  "service3_url": "https://trustoo.nl/nederland/bouwkundige-keuring/?utm_source=brevo&utm_medium=email&utm_campaign=posthire_asbest&utm_content=gerelateerd3",
  "service3_style": "",
  "service4_name": "Timmerman",
  "service4_label": "Voor timmerwerk",
  "service4_price": "€ 35 – € 50 per uur",
  "service4_url": "https://trustoo.nl/nederland/timmerman/?utm_source=brevo&utm_medium=email&utm_campaign=posthire_asbest&utm_content=gerelateerd4",
  "service4_style": "",
  "tile1_name": "Rijschool",
  "tile1_url": "https://trustoo.nl/nederland/rijschool/?utm_source=brevo&utm_medium=email&utm_campaign=posthire_asbest&utm_content=populair1",
  "tile2_name": "Schoonmaakbedrijf",
  "tile2_url": "https://trustoo.nl/nederland/schoonmaakbedrijf/?utm_source=brevo&utm_medium=email&utm_campaign=posthire_asbest&utm_content=populair2",
  "tile3_name": "Notaris",
  "tile3_url": "https://trustoo.nl/nederland/notaris/?utm_source=brevo&utm_medium=email&utm_campaign=posthire_asbest&utm_content=populair3",
  "tile4_name": "Schilder",
  "tile4_url": "https://trustoo.nl/nederland/schilder/?utm_source=brevo&utm_medium=email&utm_campaign=posthire_asbest&utm_content=populair4",
  "tiles_style": ""
}
