{
  "title": "Fijn dat je loodgieter geregeld is",
  "subject_line": "Fijn dat je loodgieter geregeld is",
  "preheader": "En heb je straks nog iets anders nodig? Dit vragen mensen daarna vaak aan.",
  "campaign_key": "posthire_loodgieter",
  "hero_image_url": "https://img.mailinblue.com/9986607/images/rnb/original/6a99ca7aacfba11dfcf18786.jpg",
  "hero_image_alt": "Loodgieter aan het werk: leidingen aansluiten onder wastafel",
  "hero_subtitle": "Je aanvraag voor een loodgieter is afgerond. Heb je straks nog iets anders nodig? Op Trustoo vergelijk je gratis de beste bedrijven bij jou in de buurt.",
  "services_intro": "Dit vragen mensen na een loodgieter vaak ook aan.",
  "service1_name": "Badkamerspecialist",
  "service1_label": "Voor je badkamer",
  "service1_price": "€ 8.500 – € 15.000",
  "service1_url": "https://trustoo.nl/nederland/badkamer-renovatie/?utm_source=brevo&utm_medium=email&utm_campaign=posthire_loodgieter&utm_content=gerelateerd1",
  "service1_style": "",
  "service2_name": "Elektricien",
  "service2_label": "Voor stroom en verlichting",
  "service2_price": "€ 35 – € 70 per uur",
  "service2_url": "https://trustoo.nl/nederland/elektricien/?utm_source=brevo&utm_medium=email&utm_campaign=posthire_loodgieter&utm_content=gerelateerd2",
  "service2_style": "",
  "service3_name": "Cv-installateur",
  "service3_label": "Voor een warm huis",
  "service3_price": "Ketel: € 900 – € 3.000",
  "service3_url": "https://trustoo.nl/nederland/cv-verwarmings-installateur/?utm_source=brevo&utm_medium=email&utm_campaign=posthire_loodgieter&utm_content=gerelateerd3",
  "service3_style": "",
  "service4_name": "Keukenspecialist",
  "service4_label": "Voor je keuken",
  "service4_price": "€ 30 – € 50 per uur",
  "service4_url": "https://trustoo.nl/nederland/keukenrenovatie/?utm_source=brevo&utm_medium=email&utm_campaign=posthire_loodgieter&utm_content=gerelateerd4",
  "service4_style": "",
  "tile1_name": "Rijschool",
  "tile1_url": "https://trustoo.nl/nederland/rijschool/?utm_source=brevo&utm_medium=email&utm_campaign=posthire_loodgieter&utm_content=populair1",
  "tile2_name": "Schoonmaakbedrijf",
  "tile2_url": "https://trustoo.nl/nederland/schoonmaakbedrijf/?utm_source=brevo&utm_medium=email&utm_campaign=posthire_loodgieter&utm_content=populair2",
  "tile3_name": "Notaris",
  "tile3_url": "https://trustoo.nl/nederland/notaris/?utm_source=brevo&utm_medium=email&utm_campaign=posthire_loodgieter&utm_content=populair3",
  "tile4_name": "Schilder",
  "tile4_url": "https://trustoo.nl/nederland/schilder/?utm_source=brevo&utm_medium=email&utm_campaign=posthire_loodgieter&utm_content=populair4",
  "tiles_style": ""
}
