{
  "title": "Fijn dat je zonweringspecialist geregeld is",
  "subject_line": "Fijn dat je zonweringspecialist geregeld is",
  "preheader": "En heb je straks nog iets anders nodig? Dit vragen mensen daarna vaak aan.",
  "campaign_key": "posthire_zonwering",
  "hero_image_url": "https://img.mailinblue.com/9986607/images/rnb/original/6a99caa025aaba004d88dfa4.jpg",
  "hero_image_alt": "Zonweringsmonteur aan het werk: elektrisch zonnescherm installeren",
  "hero_subtitle": "Je aanvraag voor een zonweringspecialist is afgerond. Heb je straks nog iets anders nodig? Op Trustoo vergelijk je gratis de beste bedrijven bij jou in de buurt.",
  "services_intro": "Dit vragen mensen na een zonweringspecialist vaak ook aan.",
  "service1_name": "Kozijnspecialist",
  "service1_label": "Voor nieuwe kozijnen",
  "service1_price": "€ 800 – € 1.500 per stuk",
  "service1_url": "https://trustoo.nl/nederland/kozijnen/?utm_source=brevo&utm_medium=email&utm_campaign=posthire_zonwering&utm_content=gerelateerd1",
  "service1_style": "",
  "service2_name": "Glaszetter",
  "service2_label": "Voor nieuw glas",
  "service2_price": "Prijs op maat",
  "service2_url": "https://trustoo.nl/nederland/glaszetter/?utm_source=brevo&utm_medium=email&utm_campaign=posthire_zonwering&utm_content=gerelateerd2",
  "service2_style": "",
  "service3_name": "Hovenier",
  "service3_label": "Voor je tuin",
  "service3_price": "€ 35 – € 65 per uur",
  "service3_url": "https://trustoo.nl/nederland/hovenier/?utm_source=brevo&utm_medium=email&utm_campaign=posthire_zonwering&utm_content=gerelateerd3",
  "service3_style": "",
  "service4_name": "Schilder",
  "service4_label": "Voor binnen en buiten",
  "service4_price": "€ 35 – € 50 per uur",
  "service4_url": "https://trustoo.nl/nederland/schilder/?utm_source=brevo&utm_medium=email&utm_campaign=posthire_zonwering&utm_content=gerelateerd4",
  "service4_style": "",
  "tile1_name": "Rijschool",
  "tile1_url": "https://trustoo.nl/nederland/rijschool/?utm_source=brevo&utm_medium=email&utm_campaign=posthire_zonwering&utm_content=populair1",
  "tile2_name": "Schoonmaakbedrijf",
  "tile2_url": "https://trustoo.nl/nederland/schoonmaakbedrijf/?utm_source=brevo&utm_medium=email&utm_campaign=posthire_zonwering&utm_content=populair2",
  "tile3_name": "Notaris",
  "tile3_url": "https://trustoo.nl/nederland/notaris/?utm_source=brevo&utm_medium=email&utm_campaign=posthire_zonwering&utm_content=populair3",
  "tile4_name": "Advocaat",
  "tile4_url": "https://trustoo.nl/nederland/advocaat/?utm_source=brevo&utm_medium=email&utm_campaign=posthire_zonwering&utm_content=populair4",
  "tiles_style": ""
}
