{
  "title": "Fijn dat je timmerman geregeld is",
  "subject_line": "Fijn dat je timmerman geregeld is",
  "preheader": "En heb je straks nog iets anders nodig? Dit vragen mensen daarna vaak aan.",
  "campaign_key": "posthire_timmerman",
  "hero_image_url": "https://img.mailinblue.com/9986607/images/rnb/original/6a99ca9025aaba004d88df9d.jpg",
  "hero_image_alt": "Timmerman aan het werk: houten constructie op maat maken",
  "hero_subtitle": "Je aanvraag voor een timmerman is afgerond. Heb je straks nog iets anders nodig? Op Trustoo vergelijk je gratis de beste bedrijven bij jou in de buurt.",
  "services_intro": "Dit vragen mensen na een timmerman vaak ook aan.",
  "service1_name": "Aannemer",
  "service1_label": "Voor bouwen en verbouwen",
  "service1_price": "€ 35 – € 60 per uur",
  "service1_url": "https://trustoo.nl/nederland/aannemer/?utm_source=brevo&utm_medium=email&utm_campaign=posthire_timmerman&utm_content=gerelateerd1",
  "service1_style": "",
  "service2_name": "Stukadoor",
  "service2_label": "Voor strakke muren",
  "service2_price": "€ 15 – € 25 per m²",
  "service2_url": "https://trustoo.nl/nederland/stukadoor/?utm_source=brevo&utm_medium=email&utm_campaign=posthire_timmerman&utm_content=gerelateerd2",
  "service2_style": "",
  "service3_name": "Schilder",
  "service3_label": "Voor binnen en buiten",
  "service3_price": "€ 35 – € 50 per uur",
  "service3_url": "https://trustoo.nl/nederland/schilder/?utm_source=brevo&utm_medium=email&utm_campaign=posthire_timmerman&utm_content=gerelateerd3",
  "service3_style": "",
  "service4_name": "Elektricien",
  "service4_label": "Voor stroom en verlichting",
  "service4_price": "€ 35 – € 70 per uur",
  "service4_url": "https://trustoo.nl/nederland/elektricien/?utm_source=brevo&utm_medium=email&utm_campaign=posthire_timmerman&utm_content=gerelateerd4",
  "service4_style": "",
  "tile1_name": "Rijschool",
  "tile1_url": "https://trustoo.nl/nederland/rijschool/?utm_source=brevo&utm_medium=email&utm_campaign=posthire_timmerman&utm_content=populair1",
  "tile2_name": "Schoonmaakbedrijf",
  "tile2_url": "https://trustoo.nl/nederland/schoonmaakbedrijf/?utm_source=brevo&utm_medium=email&utm_campaign=posthire_timmerman&utm_content=populair2",
  "tile3_name": "Notaris",
  "tile3_url": "https://trustoo.nl/nederland/notaris/?utm_source=brevo&utm_medium=email&utm_campaign=posthire_timmerman&utm_content=populair3",
  "tile4_name": "Advocaat",
  "tile4_url": "https://trustoo.nl/nederland/advocaat/?utm_source=brevo&utm_medium=email&utm_campaign=posthire_timmerman&utm_content=populair4",
  "tiles_style": ""
}
