{
  "title": "Fijn dat je fotograaf geregeld is",
  "subject_line": "Fijn dat je fotograaf geregeld is",
  "preheader": "En heb je straks nog iets anders nodig? Dit vragen mensen daarna vaak aan.",
  "campaign_key": "posthire_fotograaf",
  "hero_image_url": "https://img.mailinblue.com/9986607/images/rnb/original/6a99ca6db423db7c1ead99b2.jpg",
  "hero_image_alt": "Fotograaf aan het werk: portret fotograferen op locatie",
  "hero_subtitle": "Je aanvraag voor een fotograaf is afgerond. Heb je straks nog iets anders nodig? Op Trustoo vergelijk je gratis de beste bedrijven bij jou in de buurt.",
  "services_intro": "Dit vragen mensen na een fotograaf vaak ook aan.",
  "service1_name": "Videograaf",
  "service1_label": "Voor een film",
  "service1_price": "Prijs op maat",
  "service1_url": "https://trustoo.nl/nederland/videograaf/?utm_source=brevo&utm_medium=email&utm_campaign=posthire_fotograaf&utm_content=gerelateerd1",
  "service1_style": "",
  "service2_name": "Dj",
  "service2_label": "Voor de muziek",
  "service2_price": "€ 125 – € 200 per uur",
  "service2_url": "https://trustoo.nl/nederland/dj/?utm_source=brevo&utm_medium=email&utm_campaign=posthire_fotograaf&utm_content=gerelateerd2",
  "service2_style": "",
  "service3_name": "Cateraar",
  "service3_label": "Voor eten en drinken",
  "service3_price": "€ 15,50 – € 22 p.p.",
  "service3_url": "https://trustoo.nl/nederland/catering/?utm_source=brevo&utm_medium=email&utm_campaign=posthire_fotograaf&utm_content=gerelateerd3",
  "service3_style": "",
  "service4_name": "Weddingplanner",
  "service4_label": "Voor de planning",
  "service4_price": "€ 3.000 – € 5.000",
  "service4_url": "https://trustoo.nl/nederland/weddingplanner/?utm_source=brevo&utm_medium=email&utm_campaign=posthire_fotograaf&utm_content=gerelateerd4",
  "service4_style": "",
  "tile1_name": "Rijschool",
  "tile1_url": "https://trustoo.nl/nederland/rijschool/?utm_source=brevo&utm_medium=email&utm_campaign=posthire_fotograaf&utm_content=populair1",
  "tile2_name": "Schoonmaakbedrijf",
  "tile2_url": "https://trustoo.nl/nederland/schoonmaakbedrijf/?utm_source=brevo&utm_medium=email&utm_campaign=posthire_fotograaf&utm_content=populair2",
  "tile3_name": "Notaris",
  "tile3_url": "https://trustoo.nl/nederland/notaris/?utm_source=brevo&utm_medium=email&utm_campaign=posthire_fotograaf&utm_content=populair3",
  "tile4_name": "Schilder",
  "tile4_url": "https://trustoo.nl/nederland/schilder/?utm_source=brevo&utm_medium=email&utm_campaign=posthire_fotograaf&utm_content=populair4",
  "tiles_style": ""
}
