{
  "title": "Fijn dat je reclamebureau geregeld is",
  "subject_line": "Fijn dat je reclamebureau geregeld is",
  "preheader": "En heb je straks nog iets anders nodig? Dit vragen mensen daarna vaak aan.",
  "campaign_key": "posthire_reclamebureau",
  "hero_image_url": "https://img.mailinblue.com/9986607/images/rnb/original/6a99ca60d6d15096d2e48ab3.jpg",
  "hero_image_alt": "Creatief marketeer aan het werk: campagneconcept bespreken met collega",
  "hero_subtitle": "Je aanvraag voor een reclamebureau is afgerond. Heb je straks nog iets anders nodig? Op Trustoo vergelijk je gratis de beste bedrijven bij jou in de buurt.",
  "services_intro": "Dit vragen mensen na een reclamebureau vaak ook aan.",
  "service1_name": "Onlinemarketingbureau",
  "service1_label": "Voor meer bezoekers",
  "service1_price": "€ 80 – € 160 per uur",
  "service1_url": "https://trustoo.nl/nederland/online-marketing/?utm_source=brevo&utm_medium=email&utm_campaign=posthire_reclamebureau&utm_content=gerelateerd1",
  "service1_style": "",
  "service2_name": "Grafisch ontwerper",
  "service2_label": "Voor een sterk ontwerp",
  "service2_price": "Prijs op maat",
  "service2_url": "https://trustoo.nl/nederland/grafisch-ontwerper/?utm_source=brevo&utm_medium=email&utm_campaign=posthire_reclamebureau&utm_content=gerelateerd2",
  "service2_style": "",
  "service3_name": "Tekstschrijver",
  "service3_label": "Voor goede teksten",
  "service3_price": "Prijs op maat",
  "service3_url": "https://trustoo.nl/nederland/tekstschrijver/?utm_source=brevo&utm_medium=email&utm_campaign=posthire_reclamebureau&utm_content=gerelateerd3",
  "service3_style": "",
  "service4_name": "Webdesigner",
  "service4_label": "Voor je website",
  "service4_price": "Basis: € 500 – € 2.000",
  "service4_url": "https://trustoo.nl/nederland/webdesign/?utm_source=brevo&utm_medium=email&utm_campaign=posthire_reclamebureau&utm_content=gerelateerd4",
  "service4_style": "",
  "tile1_name": "Rijschool",
  "tile1_url": "https://trustoo.nl/nederland/rijschool/?utm_source=brevo&utm_medium=email&utm_campaign=posthire_reclamebureau&utm_content=populair1",
  "tile2_name": "Schoonmaakbedrijf",
  "tile2_url": "https://trustoo.nl/nederland/schoonmaakbedrijf/?utm_source=brevo&utm_medium=email&utm_campaign=posthire_reclamebureau&utm_content=populair2",
  "tile3_name": "Notaris",
  "tile3_url": "https://trustoo.nl/nederland/notaris/?utm_source=brevo&utm_medium=email&utm_campaign=posthire_reclamebureau&utm_content=populair3",
  "tile4_name": "Schilder",
  "tile4_url": "https://trustoo.nl/nederland/schilder/?utm_source=brevo&utm_medium=email&utm_campaign=posthire_reclamebureau&utm_content=populair4",
  "tiles_style": ""
}
