{
  "title": "Fijn dat je vochtbestrijder geregeld is",
  "subject_line": "Fijn dat je vochtbestrijder geregeld is",
  "preheader": "En heb je straks nog iets anders nodig? Dit vragen mensen daarna vaak aan.",
  "campaign_key": "posthire_vochtbestrijding",
  "hero_image_url": "https://img.mailinblue.com/9986607/images/rnb/original/6a99ca9bbe55c06bad68f884.jpg",
  "hero_image_alt": "Vochtbestrijder aan het werk: vochtmeting uitvoeren op muur",
  "hero_subtitle": "Je aanvraag voor een vochtbestrijder is afgerond. Heb je straks nog iets anders nodig? Op Trustoo vergelijk je gratis de beste bedrijven bij jou in de buurt.",
  "services_intro": "Dit vragen mensen na een vochtbestrijder vaak ook aan.",
  "service1_name": "Loodgieter",
  "service1_label": "Voor water en afvoer",
  "service1_price": "€ 40 – € 80 per uur",
  "service1_url": "https://trustoo.nl/nederland/loodgieter/?utm_source=brevo&utm_medium=email&utm_campaign=posthire_vochtbestrijding&utm_content=gerelateerd1",
  "service1_style": "",
  "service2_name": "Isolatiebedrijf",
  "service2_label": "Voor warmte binnen",
  "service2_price": "€ 25 – € 65 per m²",
  "service2_url": "https://trustoo.nl/nederland/isolatie/?utm_source=brevo&utm_medium=email&utm_campaign=posthire_vochtbestrijding&utm_content=gerelateerd2",
  "service2_style": "",
  "service3_name": "Bouwkundig keurder",
  "service3_label": "Voor zekerheid vooraf",
  "service3_price": "€ 350 – € 500",
  "service3_url": "https://trustoo.nl/nederland/bouwkundige-keuring/?utm_source=brevo&utm_medium=email&utm_campaign=posthire_vochtbestrijding&utm_content=gerelateerd3",
  "service3_style": "",
  "service4_name": "",
  "service4_label": "",
  "service4_price": "",
  "service4_url": "https://trustoo.nl/",
  "service4_style": "display:none; mso-hide:all;",
  "tile1_name": "Rijschool",
  "tile1_url": "https://trustoo.nl/nederland/rijschool/?utm_source=brevo&utm_medium=email&utm_campaign=posthire_vochtbestrijding&utm_content=populair1",
  "tile2_name": "Schoonmaakbedrijf",
  "tile2_url": "https://trustoo.nl/nederland/schoonmaakbedrijf/?utm_source=brevo&utm_medium=email&utm_campaign=posthire_vochtbestrijding&utm_content=populair2",
  "tile3_name": "Notaris",
  "tile3_url": "https://trustoo.nl/nederland/notaris/?utm_source=brevo&utm_medium=email&utm_campaign=posthire_vochtbestrijding&utm_content=populair3",
  "tile4_name": "Schilder",
  "tile4_url": "https://trustoo.nl/nederland/schilder/?utm_source=brevo&utm_medium=email&utm_campaign=posthire_vochtbestrijding&utm_content=populair4",
  "tiles_style": ""
}
