{
  "title": "Fijn dat je klusjesman geregeld is",
  "subject_line": "Fijn dat je klusjesman geregeld is",
  "preheader": "En heb je straks nog iets anders nodig? Dit vragen mensen daarna vaak aan.",
  "campaign_key": "posthire_klusjesman",
  "hero_image_url": "https://img.mailinblue.com/9986607/images/rnb/original/6a99ca7825aaba004d88df93.jpg",
  "hero_image_alt": "Klusjesman aan het werk: kast of plank monteren",
  "hero_subtitle": "Je aanvraag voor een klusjesman is afgerond. Heb je straks nog iets anders nodig? Op Trustoo vergelijk je gratis de beste bedrijven bij jou in de buurt.",
  "services_intro": "Dit vragen mensen na een klusjesman vaak ook aan.",
  "service1_name": "Schilder",
  "service1_label": "Voor binnen en buiten",
  "service1_price": "€ 35 – € 50 per uur",
  "service1_url": "https://trustoo.nl/nederland/schilder/?utm_source=brevo&utm_medium=email&utm_campaign=posthire_klusjesman&utm_content=gerelateerd1",
  "service1_style": "",
  "service2_name": "Loodgieter",
  "service2_label": "Voor water en afvoer",
  "service2_price": "€ 40 – € 80 per uur",
  "service2_url": "https://trustoo.nl/nederland/loodgieter/?utm_source=brevo&utm_medium=email&utm_campaign=posthire_klusjesman&utm_content=gerelateerd2",
  "service2_style": "",
  "service3_name": "Elektricien",
  "service3_label": "Voor stroom en verlichting",
  "service3_price": "€ 35 – € 70 per uur",
  "service3_url": "https://trustoo.nl/nederland/elektricien/?utm_source=brevo&utm_medium=email&utm_campaign=posthire_klusjesman&utm_content=gerelateerd3",
  "service3_style": "",
  "service4_name": "Meubelmaker",
  "service4_label": "Voor maatmeubels",
  "service4_price": "Prijs op maat",
  "service4_url": "https://trustoo.nl/nederland/meubelmaker/?utm_source=brevo&utm_medium=email&utm_campaign=posthire_klusjesman&utm_content=gerelateerd4",
  "service4_style": "",
  "tile1_name": "Rijschool",
  "tile1_url": "https://trustoo.nl/nederland/rijschool/?utm_source=brevo&utm_medium=email&utm_campaign=posthire_klusjesman&utm_content=populair1",
  "tile2_name": "Schoonmaakbedrijf",
  "tile2_url": "https://trustoo.nl/nederland/schoonmaakbedrijf/?utm_source=brevo&utm_medium=email&utm_campaign=posthire_klusjesman&utm_content=populair2",
  "tile3_name": "Notaris",
  "tile3_url": "https://trustoo.nl/nederland/notaris/?utm_source=brevo&utm_medium=email&utm_campaign=posthire_klusjesman&utm_content=populair3",
  "tile4_name": "Advocaat",
  "tile4_url": "https://trustoo.nl/nederland/advocaat/?utm_source=brevo&utm_medium=email&utm_campaign=posthire_klusjesman&utm_content=populair4",
  "tiles_style": ""
}
