{
  "title": "Fijn dat je boomverzorger geregeld is",
  "subject_line": "Fijn dat je boomverzorger geregeld is",
  "preheader": "En heb je straks nog iets anders nodig? Dit vragen mensen daarna vaak aan.",
  "campaign_key": "posthire_boomverzorging",
  "hero_image_url": "https://img.mailinblue.com/9986607/images/rnb/original/6a99ca5dd6d15096d2e48ab1.jpg",
  "hero_image_alt": "Boomverzorger aan het werk: boom professioneel snoeien",
  "hero_subtitle": "Je aanvraag voor een boomverzorger is afgerond. Heb je straks nog iets anders nodig? Op Trustoo vergelijk je gratis de beste bedrijven bij jou in de buurt.",
  "services_intro": "Dit vragen mensen na een boomverzorger vaak ook aan.",
  "service1_name": "Hovenier",
  "service1_label": "Voor je tuin",
  "service1_price": "€ 35 – € 65 per uur",
  "service1_url": "https://trustoo.nl/nederland/hovenier/?utm_source=brevo&utm_medium=email&utm_campaign=posthire_boomverzorging&utm_content=gerelateerd1",
  "service1_style": "",
  "service2_name": "Stratenmaker",
  "service2_label": "Voor terras, pad of oprit",
  "service2_price": "€ 40 – € 100 per m²",
  "service2_url": "https://trustoo.nl/nederland/stratenmaker/?utm_source=brevo&utm_medium=email&utm_campaign=posthire_boomverzorging&utm_content=gerelateerd2",
  "service2_style": "",
  "service3_name": "Klusjesman",
  "service3_label": "Voor andere klussen",
  "service3_price": "€ 30 – € 55 per uur",
  "service3_url": "https://trustoo.nl/nederland/klusjesman/?utm_source=brevo&utm_medium=email&utm_campaign=posthire_boomverzorging&utm_content=gerelateerd3",
  "service3_style": "",
  "service4_name": "Schoorsteenveger",
  "service4_label": "Voor een veilige schoorsteen",
  "service4_price": "€ 55 – € 100 per keer",
  "service4_url": "https://trustoo.nl/nederland/schoorsteenveger/?utm_source=brevo&utm_medium=email&utm_campaign=posthire_boomverzorging&utm_content=gerelateerd4",
  "service4_style": "display:none; mso-hide:all;",
  "tile1_name": "Rijschool",
  "tile1_url": "https://trustoo.nl/nederland/rijschool/?utm_source=brevo&utm_medium=email&utm_campaign=posthire_boomverzorging&utm_content=populair1",
  "tile2_name": "Schoonmaakbedrijf",
  "tile2_url": "https://trustoo.nl/nederland/schoonmaakbedrijf/?utm_source=brevo&utm_medium=email&utm_campaign=posthire_boomverzorging&utm_content=populair2",
  "tile3_name": "Notaris",
  "tile3_url": "https://trustoo.nl/nederland/notaris/?utm_source=brevo&utm_medium=email&utm_campaign=posthire_boomverzorging&utm_content=populair3",
  "tile4_name": "Schilder",
  "tile4_url": "https://trustoo.nl/nederland/schilder/?utm_source=brevo&utm_medium=email&utm_campaign=posthire_boomverzorging&utm_content=populair4",
  "tiles_style": ""
}
