{
  "title": "Fijn dat je verhuisbedrijf geregeld is",
  "subject_line": "Fijn dat je verhuisbedrijf geregeld is",
  "preheader": "En heb je straks nog iets anders nodig? Dit vragen mensen daarna vaak aan.",
  "campaign_key": "posthire_verhuisbedrijf",
  "hero_image_url": "https://img.mailinblue.com/9986607/images/rnb/original/6a99ca96d6d15096d2e48abb.jpg",
  "hero_image_alt": "Verhuizer aan het werk: verhuisdoos zorgvuldig naar bus dragen",
  "hero_subtitle": "Je aanvraag voor een verhuisbedrijf is afgerond. Heb je straks nog iets anders nodig? Op Trustoo vergelijk je gratis de beste bedrijven bij jou in de buurt.",
  "services_intro": "Dit vragen mensen na een verhuisbedrijf vaak ook aan.",
  "service1_name": "Schoonmaakbedrijf",
  "service1_label": "Voor een schoon huis",
  "service1_price": "€ 20 – € 30 per uur",
  "service1_url": "https://trustoo.nl/nederland/schoonmaakbedrijf/?utm_source=brevo&utm_medium=email&utm_campaign=posthire_verhuisbedrijf&utm_content=gerelateerd1",
  "service1_style": "",
  "service2_name": "Opslagruimte",
  "service2_label": "Voor extra ruimte",
  "service2_price": "€ 5 – € 8 per m³/maand",
  "service2_url": "https://trustoo.nl/nederland/opslag/?utm_source=brevo&utm_medium=email&utm_campaign=posthire_verhuisbedrijf&utm_content=gerelateerd2",
  "service2_style": "",
  "service3_name": "Klusjesman",
  "service3_label": "Voor andere klussen",
  "service3_price": "€ 30 – € 55 per uur",
  "service3_url": "https://trustoo.nl/nederland/klusjesman/?utm_source=brevo&utm_medium=email&utm_campaign=posthire_verhuisbedrijf&utm_content=gerelateerd3",
  "service3_style": "",
  "service4_name": "Notaris",
  "service4_label": "Voor aktes en contracten",
  "service4_price": "€ 200 – € 800 per akte",
  "service4_url": "https://trustoo.nl/nederland/notaris/?utm_source=brevo&utm_medium=email&utm_campaign=posthire_verhuisbedrijf&utm_content=gerelateerd4",
  "service4_style": "",
  "tile1_name": "Rijschool",
  "tile1_url": "https://trustoo.nl/nederland/rijschool/?utm_source=brevo&utm_medium=email&utm_campaign=posthire_verhuisbedrijf&utm_content=populair1",
  "tile2_name": "Schilder",
  "tile2_url": "https://trustoo.nl/nederland/schilder/?utm_source=brevo&utm_medium=email&utm_campaign=posthire_verhuisbedrijf&utm_content=populair2",
  "tile3_name": "Advocaat",
  "tile3_url": "https://trustoo.nl/nederland/advocaat/?utm_source=brevo&utm_medium=email&utm_campaign=posthire_verhuisbedrijf&utm_content=populair3",
  "tile4_name": "Hovenier",
  "tile4_url": "https://trustoo.nl/nederland/hovenier/?utm_source=brevo&utm_medium=email&utm_campaign=posthire_verhuisbedrijf&utm_content=populair4",
  "tiles_style": ""
}
