{
  "title": "Fijn dat je bouwkundige keurder geregeld is",
  "subject_line": "Fijn dat je bouwkundige keurder geregeld is",
  "preheader": "En heb je straks nog iets anders nodig? Dit vragen mensen daarna vaak aan.",
  "campaign_key": "posthire_bouwkundige-keuring",
  "hero_image_url": "https://img.mailinblue.com/9986607/images/rnb/original/6a99ca5ed6d15096d2e48ab2.jpg",
  "hero_image_alt": "Bouwkundig inspecteur aan het werk: muur en kozijn inspecteren",
  "hero_subtitle": "Je aanvraag voor een bouwkundige keurder is afgerond. Heb je straks nog iets anders nodig? Op Trustoo vergelijk je gratis de beste bedrijven bij jou in de buurt.",
  "services_intro": "Dit vragen mensen na een bouwkundige keurder vaak ook aan.",
  "service1_name": "Aankoopmakelaar",
  "service1_label": "Voor de aankoop van je huis",
  "service1_price": "Vast: € 2.500 – € 5.000",
  "service1_url": "https://trustoo.nl/nederland/aankoopmakelaar/?utm_source=brevo&utm_medium=email&utm_campaign=posthire_bouwkundige-keuring&utm_content=gerelateerd1",
  "service1_style": "",
  "service2_name": "Taxateur",
  "service2_label": "Voor de waarde van je huis",
  "service2_price": "€ 500 – € 1.000",
  "service2_url": "https://trustoo.nl/nederland/taxateur/?utm_source=brevo&utm_medium=email&utm_campaign=posthire_bouwkundige-keuring&utm_content=gerelateerd2",
  "service2_style": "",
  "service3_name": "Hypotheekadviseur",
  "service3_label": "Voor je financiering",
  "service3_price": "€ 2.000 – € 3.000",
  "service3_url": "https://trustoo.nl/nederland/hypotheekadviseur/?utm_source=brevo&utm_medium=email&utm_campaign=posthire_bouwkundige-keuring&utm_content=gerelateerd3",
  "service3_style": "",
  "service4_name": "Energielabel-adviseur",
  "service4_label": "Voor je energielabel",
  "service4_price": "€ 250 – € 480",
  "service4_url": "https://trustoo.nl/nederland/energielabel-adviseur/?utm_source=brevo&utm_medium=email&utm_campaign=posthire_bouwkundige-keuring&utm_content=gerelateerd4",
  "service4_style": "",
  "tile1_name": "Rijschool",
  "tile1_url": "https://trustoo.nl/nederland/rijschool/?utm_source=brevo&utm_medium=email&utm_campaign=posthire_bouwkundige-keuring&utm_content=populair1",
  "tile2_name": "Schoonmaakbedrijf",
  "tile2_url": "https://trustoo.nl/nederland/schoonmaakbedrijf/?utm_source=brevo&utm_medium=email&utm_campaign=posthire_bouwkundige-keuring&utm_content=populair2",
  "tile3_name": "Notaris",
  "tile3_url": "https://trustoo.nl/nederland/notaris/?utm_source=brevo&utm_medium=email&utm_campaign=posthire_bouwkundige-keuring&utm_content=populair3",
  "tile4_name": "Schilder",
  "tile4_url": "https://trustoo.nl/nederland/schilder/?utm_source=brevo&utm_medium=email&utm_campaign=posthire_bouwkundige-keuring&utm_content=populair4",
  "tiles_style": ""
}
