{
  "title": "Fijn dat je schilder geregeld is",
  "subject_line": "Fijn dat je schilder geregeld is",
  "preheader": "En heb je straks nog iets anders nodig? Dit vragen mensen daarna vaak aan.",
  "campaign_key": "posthire_schilder",
  "hero_image_url": "https://img.mailinblue.com/9986607/images/rnb/original/6a99ca89d6d15096d2e48aba.jpg",
  "hero_image_alt": "Schilder aan het werk: binnenmuur schilderen met roller",
  "hero_subtitle": "Je aanvraag voor een schilder is afgerond. Heb je straks nog iets anders nodig? Op Trustoo vergelijk je gratis de beste bedrijven bij jou in de buurt.",
  "services_intro": "Dit vragen mensen na een schilder vaak ook aan.",
  "service1_name": "Stukadoor",
  "service1_label": "Voor strakke muren",
  "service1_price": "€ 15 – € 25 per m²",
  "service1_url": "https://trustoo.nl/nederland/stukadoor/?utm_source=brevo&utm_medium=email&utm_campaign=posthire_schilder&utm_content=gerelateerd1",
  "service1_style": "",
  "service2_name": "Schoonmaakbedrijf",
  "service2_label": "Voor een schoon huis",
  "service2_price": "€ 20 – € 30 per uur",
  "service2_url": "https://trustoo.nl/nederland/schoonmaakbedrijf/?utm_source=brevo&utm_medium=email&utm_campaign=posthire_schilder&utm_content=gerelateerd2",
  "service2_style": "",
  "service3_name": "Verhuisbedrijf",
  "service3_label": "Voor je verhuizing",
  "service3_price": "€ 500 – € 1.500",
  "service3_url": "https://trustoo.nl/nederland/verhuisbedrijf/?utm_source=brevo&utm_medium=email&utm_campaign=posthire_schilder&utm_content=gerelateerd3",
  "service3_style": "",
  "service4_name": "Vloerlegger",
  "service4_label": "Voor een nieuwe vloer",
  "service4_price": "€ 25 – € 75 per m²",
  "service4_url": "https://trustoo.nl/nederland/vloerlegger/?utm_source=brevo&utm_medium=email&utm_campaign=posthire_schilder&utm_content=gerelateerd4",
  "service4_style": "",
  "tile1_name": "Rijschool",
  "tile1_url": "https://trustoo.nl/nederland/rijschool/?utm_source=brevo&utm_medium=email&utm_campaign=posthire_schilder&utm_content=populair1",
  "tile2_name": "Notaris",
  "tile2_url": "https://trustoo.nl/nederland/notaris/?utm_source=brevo&utm_medium=email&utm_campaign=posthire_schilder&utm_content=populair2",
  "tile3_name": "Advocaat",
  "tile3_url": "https://trustoo.nl/nederland/advocaat/?utm_source=brevo&utm_medium=email&utm_campaign=posthire_schilder&utm_content=populair3",
  "tile4_name": "Hovenier",
  "tile4_url": "https://trustoo.nl/nederland/hovenier/?utm_source=brevo&utm_medium=email&utm_campaign=posthire_schilder&utm_content=populair4",
  "tiles_style": ""
}
