{
  "title": "Fijn dat je dakgootspecialist geregeld is",
  "subject_line": "Fijn dat je dakgootspecialist geregeld is",
  "preheader": "En heb je straks nog iets anders nodig? Dit vragen mensen daarna vaak aan.",
  "campaign_key": "posthire_dakgoot",
  "hero_image_url": "https://img.mailinblue.com/9986607/images/rnb/original/6a99ca62be55c06bad68f872.jpg",
  "hero_image_alt": "Dakgootspecialist aan het werk: dakgoot vervangen",
  "hero_subtitle": "Je aanvraag voor een dakgootspecialist is afgerond. Heb je straks nog iets anders nodig? Op Trustoo vergelijk je gratis de beste bedrijven bij jou in de buurt.",
  "services_intro": "Dit vragen mensen na een dakgootspecialist vaak ook aan.",
  "service1_name": "Dakdekker",
  "service1_label": "Voor een goed dak",
  "service1_price": "€ 40 – € 50 per uur",
  "service1_url": "https://trustoo.nl/nederland/dakdekker/?utm_source=brevo&utm_medium=email&utm_campaign=posthire_dakgoot&utm_content=gerelateerd1",
  "service1_style": "",
  "service2_name": "Gevelreiniger",
  "service2_label": "Voor een schone gevel",
  "service2_price": "€ 10 – € 20 per m²",
  "service2_url": "https://trustoo.nl/nederland/gevelreiniging/?utm_source=brevo&utm_medium=email&utm_campaign=posthire_dakgoot&utm_content=gerelateerd2",
  "service2_style": "",
  "service3_name": "Schoorsteenveger",
  "service3_label": "Voor een veilige schoorsteen",
  "service3_price": "€ 55 – € 100 per keer",
  "service3_url": "https://trustoo.nl/nederland/schoorsteenveger/?utm_source=brevo&utm_medium=email&utm_campaign=posthire_dakgoot&utm_content=gerelateerd3",
  "service3_style": "",
  "service4_name": "Klusjesman",
  "service4_label": "Voor andere klussen",
  "service4_price": "€ 30 – € 55 per uur",
  "service4_url": "https://trustoo.nl/nederland/klusjesman/?utm_source=brevo&utm_medium=email&utm_campaign=posthire_dakgoot&utm_content=gerelateerd4",
  "service4_style": "",
  "tile1_name": "Rijschool",
  "tile1_url": "https://trustoo.nl/nederland/rijschool/?utm_source=brevo&utm_medium=email&utm_campaign=posthire_dakgoot&utm_content=populair1",
  "tile2_name": "Schoonmaakbedrijf",
  "tile2_url": "https://trustoo.nl/nederland/schoonmaakbedrijf/?utm_source=brevo&utm_medium=email&utm_campaign=posthire_dakgoot&utm_content=populair2",
  "tile3_name": "Notaris",
  "tile3_url": "https://trustoo.nl/nederland/notaris/?utm_source=brevo&utm_medium=email&utm_campaign=posthire_dakgoot&utm_content=populair3",
  "tile4_name": "Schilder",
  "tile4_url": "https://trustoo.nl/nederland/schilder/?utm_source=brevo&utm_medium=email&utm_campaign=posthire_dakgoot&utm_content=populair4",
  "tiles_style": ""
}
